{
  "schemaVersion": 1,
  "project": "game-slug",
  "defaultTarget": "ABC123-rev0",
  "targets": [
    {
      "target": {"id": "ABC123-rev0", "platform": "gamecube", "gameId": "ABC123", "region": "USA", "discRevision": 0, "sha1": "0123456789abcdef0123456789abcdef01234567"},
      "status": "active",
      "support": {"build": true, "reportFormats": ["report-v2"]},
      "legacyTargets": []
    }
  ]
}
